"what's needed are more details as to exactly why mccabe is the only bone marrow match that works ; there would seem to be other possible contenders somewhere in the country , and thus many of the ways that connor endangers the lives of himself and those around him by attempting to keep mccabe alive are just a little too hard to swallow .",negative
"take , for example , a scene where mccabe is trying to make a getaway by climbing over an elevated passage tunnel connecting two sections of the hospital .",negative
"the police have their spotlight and guns aimed right on him , and what does connor do ?",negative
he shoots the spotlight out so that mccabe can continue his flight .,negative
"connor knows very well what dangerous deeds this guy is capable of , and yet never seems to think that mccabe will eventually get to and try to harm his son .",negative
whatever .,negative
"to be fair , though , the lack of story background is the least of the movie's problems .",negative
"first and foremost is how cheaply "" desperate measures "" trades the potential of it's opening scenes for the routine action ballistics of its final hour .",negative
"once mccabe escapes , the film becomes the fugitive in reverse and with no thrills .",negative
there are countless scenes where the good guys catch up to keaton only to have him grab a hostage and get away .,negative
"also , the movie is so intent on giving you a hoot-inducing , lip-smacking villain ( the ads have compared peter mccabe to hannibal lechter , natch ) that it completely casts garcia's frank connor by the dullsville wayside ; "" desperate measures "" appears to like its antagonist so much more than its protagonist , and the movie's head-scratcher of a send-off confirms this .",negative
"there is some good to be found amongst this mess , particularly in the acting department .",negative
"cast against type , michael keaton's understated menace is highly effective .",negative
"although he's not given much believable to work with , andy garcia plays off a taut emotional chord .",negative
"joseph cross , as garicia's ailing son , is surprisingly unsentimental , and marcia gay harden lends solid support as a doctor who becomes a major player in the unfolding chaos .",negative
"this cast does its best to camouflage the sorry plot as it chugs towards an inevitably happy ending , but most is lost .",negative
"it goes without saying that "" desperate measures "" needs an operation of its very own .",negative
" "" goodbye , lover "" sat on the shelf for almost a year since its lukewarm reception at the cannes film festival last may , and one look will tell you why .",negative
it's a mess .,negative
and that's * way * before ellen degeneres shows up .,negative
"the film is one of those torrid double-indemnity crime stories that , in this case , required the services of three screenwriters .",negative
"i suspect that one wrote a sexy thriller , one wrote a murder mystery , and one wrote a comedy , then director roland joff ? tried to piece it all together in the editing room while scratching his head in bewilderment .",negative
i didn't laugh at ellen degeneres much ( i think i was supposed to ) .,negative
"degeneres is horrible and her character is even worse , a tough-talking vulgar cop with a bad wardrobe and bad hair .",negative
either degeneres is wearing a wig--as most of the actors appear to be--or she doesn't yet have enough clout to secure a hairstylist .,negative
"every single word out of her mouth is supposed to be racy and hip , but her incessant wisecracking is poorly-written and merely stupid .",negative
"her reaction to the brutal killing of a jogger is "" at least she died healthy . """,negative
and that's one of her wittier asides .,negative
degeneres' sgt .,negative
rita pompano is called in to investigate the allegedly accidental death of . . . wait .,negative
to give away too much of the plot would all but ruin a film that has very little going for it outside of its numbing plot twists and multiple triple-crosses .,negative
it's best described this way :,negative
"sultry sexpot/real estate agent sandra dunmore ( patricia arquette ) is married to jake , a "" creative yet unfocused "" ( and alcoholic ) advertising rep , played by dermot mulroney .",negative
sandra likes to act out her deep-seated sexual fantasies and jake's brother ben ( the suave-as-ever don johnson ) likes to help .,negative
"ben is also coming on to his petite , mousy co-worker peggy blaine ( mary-louise parker ) and someone , somewhere , is planning to cash in on that huge life insurance policy of his .",negative
the film is ripe with cheating lovers cheating on each other and back again .,negative
"although there are some genuine surprises , the plot twists get too contrived too quickly .",negative
probably around the time degeneres' gumcracking gumshoe appears .,negative
"at least the former "" ellen "" star is going for something a little different .",negative
"arquette turns in yet another of her stiletto-heeled , platinum blonde bombshell roles ( see : "" lost highway , "" "" true romance "" ) while quoting embarrassing lines like "" i'm not wearing any underwear . """,negative
i hope she got paid a lot of money to do this .,negative
here's an example of some of the film's flat-out stupidity .,negative
sandra purchases a used car and disguises herself in a red wig prior to stalking two of the film's duplicitous lovers .,negative
"she drives the motorbiking couple off a cliff while blaring her favorite "" the sound of music "" on her car stereo , intent on identifying herself to her hapless victims .",negative
so what was the point of the wig and the car ?,negative
" "" the sound of music "" stuff might be a reference to "" the wizard of oz "" allusions in david lynch's "" wild at heart , "" but if so joff ? must have forgotten that "" wild at heart "" was a despicable movie .",negative
"it's hard to believe that "" goodbye , lover "" was directed by the same person who made "" the killing fields "" and "" the mission . """,negative
"it's not , however , hard to see why it sat on the shelf for so long .",negative
it should have stayed there .,negative
"capsule : the much anticipated re-adaptation of the pierre boulle novel comes to the screen as a dark and a little dreary film with lots of chases and fighting , but very little intelligence .",negative
"visually there is much to like about this version , but the approach is to take an adventure after the style of gulliver's travels and treat it as an action film .",negative
that makes it a film without much center .,negative
" , 0 ( -4 to +4 )",negative
"pierre boulle , author of the bridge on the river kwai , wrote planet of the apes ( a . k . a . monkey planet ) , the novel , as a social satire .",negative
it reads a lot like a fifth book of gulliver's travels .,negative
"humans discover a planet in which the roles of apes and humans have been reversed , not unlike the roles of horses and humans on jonathan swift's island of the houyhnhnms .",negative
the novel moves somewhat slowly to create some suspense in revealing all the things most film fans know to be true about the nature of the planet .,negative
"it seems to me there is also a statement about human cruelty to animals , but perhaps i was just looking for that .",negative
"when rod serling adapted the novel into a film released in 1968 , he added a number of serling touches , familiar from episodes of the twilight zone and changed the ending to make it more serling-ish .",negative
the final irony of the original version has become film history .,negative
"without it there could never have been a "" planet of the apes "" film series .",negative
i can surmise only that serling ran into serious script problems in how to handle the tricky question of language .,negative
in the book the apes had their own language and the human eventually learned that language .,negative
"that could have been done in the film , but that would have required the entire film to be subtitled for the non-ape-speaking .",negative
"serling avoided this by having the apes speak english and , of course , there is some justification for that by the end of the film .",negative
justifying why the apes spoke english may have even been the inspiration for his surprise ending .,negative
"but serling never tackles the all-important question of why a supposedly intelligent human never shows any curiosity or even surprise that the apes speak his own language , a language they had no opportunity to ever hear .",negative
"few viewers questioned this serious plot hole , however , and the film has become well respected in cinema history .",negative
partial credit at least should go to jerry goldsmith whose extremely inventive score is one of goldsmith's best if not his best .,negative
"when the film's success called for sequels , the filmmakers turned up the violence and they added well-intentioned , though not very subtle , political messages about what was happening in the united states of the 1960s and 1970s .",negative
"while the first film had a little shooting of guns and what was there seemed a little half- hearted , by the second film , beneath the planet of the apes , there was a good deal more violence and from that point on the series had a lot of violence and chases .",negative
the series concluded with battle for the planet of the apes in 1973 .,negative
now director tim burton tries his hand at adapting the original book again .,negative
"for those who thought that the 1968 version was not very faithful to the book , burton's new version is even less faithful .",negative
"first , he does not really reverse the roles of the humans and the apes .",negative
"he has them both be intelligent , articulate races battling for a dominance of the planet currently in the hands , uh , make that paws , of the apes .",negative
"that could be a good story too , but it is not planet of the apes .",negative
"as with the mission impossible films and so many other cinematic homages to the third quarter of the last century , the title makes promises that the filmmakers have no intention of honoring .",negative
"in 2029 leo davidson ( mark wahlberg , not this world's most expressive actor ) works on a space station increasing the intelligence and usefulness of apes .",negative
then a convenient time storm sweeps him up wizard-of-oz-fashion and drops him on an alien planet .,negative
" ( yes , he survives this storm , but then no storm is perfect . )",negative
"he quickly finds , not greatly to any surprise he shows , that on this planet apes rule and humans drool , but everybody talks .",negative
and the language they talk is earth- english .,negative
apparently it does not even occur to leo that there is a mystery that needs to be explained about that .,negative
the fact it does not occur to leo and apparently didn't occur to tim burton either is the heart of the real horror of this film .,negative
both just assumed that if apes were going to talk the language they would speak would be english .,negative
in any case having one talking race dominating another makes this not a look at human-animal relationships and more one of the master-slave relationships .,negative
outside of sudan and a few other countries this is a less relevant topic .,negative
"leo is captured to be used as a slave but also is discovered by ari , played by helena bonham carter .",negative
ari is an attractive ape with close ties to high political power .,negative
she is bent on making the world a better place .,negative
perhaps in a previous draft of the script she was called hil-ari .,negative
"in any case with makeup that stifles her usual pout , carter is just about as attractive as she has ever been in a film .",negative
she may want to consider this to become her standard look from this point forward .,negative
it is not long before leo escapes with some human and only a couple of sympathetic apes .,negative
this is a further abandonment of the source material .,negative
"the chase severely limits the interplay of ape and human and the examination of each's place in this reversed society , each important in the book .",negative
we cannot see how the society works because most of the screentime society has broken down .,negative
we see the humans either separated from the apes or fighting them .,negative
burton chooses visceral thrills over cerebral ones at almost every turn .,negative
"this is a miscalculation , as characters so lacking in empathy value are difficult ones to place much emotional investment in .",negative
they are basically chess pieces and the viewer has little reason to root for them to win .,negative
"the 1968 script had little subtlety , with lines like "" i never met an ape i didn't like , "" but at least we cared for what happened to taylor , the main character .",negative
most of what this film has to offer is in the visuals .,negative
the visual work is spotty but generally nicely done except that so much of the film takes place in the night or in fog .,negative
this tends to limit close looks at the makeup .,negative
in general it seems much improved from 1968 .,negative
"the makeup team is led by rick baker instead of john chambers , who did it for the 1968 version .",negative
in 1968 chambers makeup was a jaw-dropper .,negative
it was realistic enough to almost be believable but flexible enough to show emotion .,negative
"chambers is good , but if anyone had a chance to best him it would have to be baker .",negative
today audiences have higher expectations ; baker's visualization is really an improvement .,negative
these visuals work nicely .,negative
what does not work is the wire- assisted leaps some of the apes make .,negative
"they look like they were inspired by the physics- defying leaps of crouching tiger , hidden dragon .",negative
apes spring incredible distances .,negative
"some of the best scenes are apes running into battle looking like they have ape posture , but when they start flying through the air the effect is lost .",negative
one final visual problem is that the film frequently shows its budget in what should be spectacular battle scenes the camera shows us only a small group of people close-up .,negative
since the days of lon chaney and boris karloff few actors have crossed over to stardom in a role that required heavy make-up .,negative
the one actor who has a shot is paul giamatti .,negative
"it is not that his lines are so good , most are silly jokes .",negative
but he delivers them very well .,negative
"he was always a watchable actor , but has not yet made stardom .",negative
"as the ape-trader limbo he over-emotes to overcome his ape make-up , but does it very well .",negative
in doing so he makes himself the most interesting thing on the screen .,negative
he is probably the best thing in the film and conjures up memories of peter ustinov's performance in spartacus .,negative
as an in-joke there are several lines in the script borrowed from the 1968 film and an old ape played by charleton heston becomes an allusion to the first film by itself .,negative
"danny elfman's score has a nice primitive feel , but jerry goldsmith's 1968 tour de force score is a real classic .",negative
that score and the whole film will be remembered when the 2001 film is forgotten .,negative
i rate the remake 4 on the 0 to 10 scale and a 0 on the -4 to +4 scale .,negative