"ever since wargames , the first real computer hacking movie , hollywood has attempted to produce more and more films about hacking . ",negative
these films usually show the audience a look into computers that really is not impossible and is usually ridiculous . ,negative
"if it's not this , the exaggeration about what is real is usually greater than you would expect . ",negative
hackers is guilty of all of these crimes . ,negative
"to anyone familiar with computers and/or the internet , most of the movie is so incredibly stupid that you can't take it anymore . ",negative
"those of you who frequent one of the greatest sites on the world wide web , the internet movie database , are probably aware of the section for movies entitled "" goofs "" . ",negative
this is the section for mistakes in the movies . ,negative
"well , imdb sums up hackers extremely well with the first goof listed : "" generally ill-informed and ridiculous to the extreme regarding the capabilities of computers and technology "" . ",negative
"and truthfully , this is one-hundred percent correct . ",negative
"the plot , obviously , centers around computer hacking . ",negative
"more specifically , it follows the exploits of dade murphy , a young computer hacker played by jonny lee miller . ",negative
"miller should be extremely thankful for the film trainspotting , because if it were not for that , who knows where his career would be now after hackers . ",negative
the film opens with a young dade murphy being arrested for hacking computer systems . ,negative
he was forbidden to use a computer until he turned eighteen years old . ,negative
"the film then picks up at that point , an eighteen year old dade murphy hacking away at the computer . ",negative
"dade later meets up with fellow hackers acid burn ( angelina jolie ) , cereal killer ( matthew lillard ) , lord nikon ( laurence mason ) , and the phantom phreak ( renoly santiago ) , who are basically trying to do what is next to impossible : hack the gibson computer and not get caught by the fbi . ",negative
"oh , and as a little sub-plot , dade also tries to woo acid burn , the only female hacker in the film . ",negative
"really , i can't think of much more to say about the film's plot aside from what i've said . ",negative
"it's just a bunch of computer geeks ( no , obsessive compulsive computer geeks a little too advanced for reality ) running around hacking computers and staying away from the fbi . ",negative
"thanks to this movie , the public unfamiliar with computers now has a distorted viewpoint of computers and what they can do . ",negative
"this movie makes computers look a little bit too advanced for their time , and the frivolous suggestions it makes are too many to list . ",negative
"to sum it up , hackers is a terrible computer film . ",negative
"if you're looking for a film about computers closer to what goes on in the real world , i suggest sneakers . ",negative
"although at times it too may seem a little far fetched , it should be much more believable than hackers to regular computer users . ",negative
"hopefully , this film didn't influence too many young computer users out to think they can do what is portrayed in this 105 minute waste of time . ",negative
"a remake of the 1978 warren beatty vehicle "" heaven can wait "" ( which in turn was a remake of "" here comes mr . jordan "" ) , "" down to earth "" tells the tale of lance barton ( chris rock , "" lethal weapon iv "" ) , a young black standup comic trying to win over the audience at harlem's apollo theater .",negative
"when he's taken to heaven prematurely by bumbling angel keyes ( eugene levy , "" best in show "" ) , his only recourse is to return in another body .",negative
"he chooses that of charles wellington , the tenth richest man in the united states .",negative
"of course , wellington is not only rich , but white and 53 years old , which makes lance's bid for closing night at the apollo , as well as his desire to woo suntee ( regina taylor , "" jerry maguire "" ) , a tad tricky .",negative
"the original elaine may/warren beatty script has been reworked by chris rock , lance crouther , ali leroi , and louis c . k .",negative
to turn beatty's vehicle as a football player into rock's vehicle as a comic and add some racial humor .,negative
"as directed by chris weitz and paul weitz ( codirectors of "" american pie "" and costars of "" chuck & buck "" ) , the whole affair comes off as amateur hour .",negative
initial scenes play like filmed line reading rehearsals .,negative
production values are shoddy .,negative
most serious of all is the use of rock when his wellington counterpart would have been more appropriate .,negative
this problem is clearly attributable to the fact that the old white guy is never lip or action synched when he is on screen .,negative
"rock does get the chance to do some fun schtick , such as his turnaround on wellington's plans for a poor neighborhood hospital ( 'bullet in the head ?",negative
"you got a bed ! ' ) , but he's uneven when interacting with the rest of the cast .",negative
regina taylor fares well amidst the mediocrity as the young activist who confusedly ends up falling for the man she believed to be her nemesis .,negative
"also good is frankie faison ( "" hannibal "" ) as whitney , lance's compassionate manager - the only human who's made privy to lance's body body switch .",negative
chaz palminteri and levy are pretty much wasted as heaven's ambassadors .,negative
"another "" best in show "" alumnus , jennifer coolidge , is poorly used as wellington's cheating wife ( and shown several days apart wearing the same outfit ? ! ) and greg germann ( tv's "" ally mcbeal , "" "" sweet november "" ) continues display his sitcom roots as her lover and husband's lawyer .",negative
"mark addy ( "" the full monty "" ) is sorely underutilized as cisco , wellington's fake english butler .",negative
"stealing the show in every scene she's in is wanda sykes ( "" the chris rock show "" ) as wellington's disgruntled maid .",negative
" "" down to earth "" is for chris rock fans only .",negative
"all others should go rent "" heaven can wait "" or truly be brought down to earth .",negative
"plot : a separated , glamorous , hollywood couple must pretend to reunite for a press junket of the last movie that they ever shot together .",negative
kewl . . . now,negative
i only wish that i could pretend never to have seen this movie . . .,negative
"critique : trite , unfunny , boring and a waste of everyone's talent .",negative
"how a premise with such zest and bite can turn into a movie that doesn't feature any chemistry , any real laughs , any surprises or any spice is beyond me .",negative
"how julia roberts is used solely as a "" puppy dog "" character , puttering around in the background while we endure the complete bitchiness of zeta-jones' character , who is not one bit funny or romantic ( two ideal ingredients in a "" romantic comedy "" ) , is also beyond me .",negative
"and why they chose john cusack , a great , quirky actor in his own right , to play the most bland , uninteresting and unfetching character ( with zero chemistry with either of his leads ) is further more , beyond me .",negative
"and to anybody who decided that this project was "" funny "" enough to greenlight featuring the talents mentioned above , along with billy crystal , christopher walker , seth green and stanley tucci . . . well ,",negative
what can i say . . . i,negative
just don't have the words .,negative
so is this the worst movie that i've seen all year ?,negative
"no . but it definitely sucks and it's basically because . . . well ,",negative
it's just not funny .,negative
"and for the record , allow me to state a few more problems with it .",negative
"it starts off slow , it's got no energy , it doesn't engage you with any of its characters ( julia barely gets somewhat interesting in the film , everyone else . . . lame ! ) , it utilizes way too many flashbacks to move the story forward , it's utterly predictable , standard , routine , see-through and uninteresting as a plot and it just sits there on the screen , big and ugly , waiting . . . waiting for you to laugh or find something in it that is amusing .",negative
"and then hank azaria shows up . . . aaaaaah , the film's savior ( mind you , some might be offended by his exaggeration of a stereotype , but that's another story altogether ) .",negative
"but when an experienced "" voice "" actor upstages all of the main stars in a summer "" blockbuster "" romantic comedy with an over-the-top antonio banderas accent , damn dude . . . your",negative
film's in trouble ! !,negative
rent this movie on video just to see what went wrong yourself .,negative
"the references to ricky ricardo and senor wences ( huh ! ? ) , the idio-plot points like when one of the characters goes on the roof to stretch his arms out and relax , but everyone believes that he's going to kill himself ( hardy-har-har ) and the cheap way of getting the audience to leave the theater laughing by bringing back a ball-sniffing dog that has no place being in the location at the end of the movie , well . . . i",negative
could go on .,negative
"but i won't because i do still respect all of the actors in this film and actually did laugh at azaria , green and tucci's antics from time to time ( ironic , eh . . . what",negative
"about the leads , dammit ! ) and liked the premise behind the film ( before i saw the finished product , of course ) .",negative
a dud all the way around .,negative
"btw , all the talk about this film was that julia roberts was to be in a fat suit for one scene ( her character is supposed to have lost 60 pounds ) , so when the scene finally came , i did get a little excited about what it might look like and then . . . well ,",negative
it basically just looked like julia roberts in a fat suit !,negative
ugh .,negative
i think i'm gonna start drinking again after this lame-ass movie .,negative
"c'mon hollywood , enough with the crud !",negative
where's joblo coming from ?,negative
beautiful ( 1/10 ) - my best friend's wedding ( 7/10 ) - notting hill ( 5/10 ) - pretty woman ( 7/10 ) -runaway bride ( 5/10 ) - someone like you ( 4/10 ) - wedding planner ( 3/10 ) - when harry met sally ( 10/10 ) - you've got mail ( 4/10 ),negative
"it was once said that in order to truly enjoy some of todays movies or novels , you must suspend disbelief . ",negative
"however , there is a distinct separation between opening your mind to ridiculous situations and believing a bunch of flat lies .",negative
"it came as no surprise to me to learn that huntingburg , indiana ( where the film is set ) , does not have a mcdonald's , a sears store , a statue of a man on a horse , nor even a dam close by .",negative
even if you can ignore these somewhat white lies ( even though the dam is crucial to hard rains plot ) ; there is still a bunch of things that just dont gel .,negative
"firstly , morgan freeman , possibly the greatest actor alive ( after such films as driving miss daisy , the shawshank redemption and se7en ) , was cast as a shifty goon intent on stealing enough money for a healthy retirement .",negative
"he _should_ have played the town sheriff , an experienced and somewhat intriguing policeman .",negative
"as a massive flood started by a dam accident overwhelms huntingburg , its residents presumably flee as the water level steadily increases .",negative
i say presumably simply because we never know what happened to them ; and it seems a tad strange that an entire town ( with the exception of some folk who get introduced along the way ) can vanish before the flood has actually started .,negative
"but nether the less , armored guard couriers tom ( christian slater ) and his uncle are carrying three million dollars in the back of their van .",negative
"with a heavy rainstorm causing depressing conditions and slippery roads , it doesnt take long for the van to end up stuck amongst mud and water off the side of the road .",negative
jim ( morgan freeman ) and a small gang of thieves locate the van and attempt to steal the three million dollars .,negative
"but of course tom is more than willing to save the day , so he takes the money and hides it elsewhere in town .",negative
"the local sheriff ( randy quaid , whom most will remember as the drunken pilot in id4 ) and a couple of police men investigate the situation , but their morals are soon overpowered by greediness as each character contemplates what he/she would do with their share of the three million dollars .",negative
"director mikael salomon has made sure that hard rain ends up turning everything topsy-turvy , and whilst the film may at first appear to be a definite goodies versus baddies ,  there are numerous twists in its plot that make this a slightly more enjoyable experience .",negative
"but by the time these interesting changes occur , its far too late in the film for them to have much affect .",negative
hard rains continuos corniness and lack of originality washes out whatever hope the script may have had ; and although its cast is somewhat appealing most of its stars act well below par .,negative
"not at one stage capturing what could have been a fabulous on screen battle between slater and freeman , we are left to reminisce on films that dared to do something different and achieved more than what was expected .",negative
such titles as broken arrow ( slater and john travolta ) and face/off ( nicholas cage and john travolta ) come to mind as films that have mastered silver screen confrontations .,negative
"strangely enough , they were both directed by john woo and both star john travolta .",negative
"we can forgive morgan freeman for giving a slightly disappointing performance since he is newish to the action genre , but christian slater could have achieved so much more had the amount of crummy one liners been reduced and some personality added to his character .",negative
"if you had asked me whether slater could perform well enough to substantially boost a movie prior to the release of broken arrow , my answer would have been a definite no .",negative
"i now know that he has no excuse , and _can_ do better ( if you dont believe me rent a copy of broken arrow from your local video store ) .",negative
"although hard rain never really works from the start , i somehow felt feelings of missed opportunity when the credits filled the screen .",negative
"the addition of an enticing sub-plot would have given the film time to breathe , rather than try to cram 96 minutes of action and disaster into a story that cant handle anything else .",negative
"despite the fact that hard rain fails on almost every account , if your standards are low enough you may find this to be a mildly enjoyable film .",negative
"no creative flair and no inventive scenes means that hard rain does not stand up well against its many competitors , but it doesnt really matter since the last thing you would want to do after shelling about $8 . 50 is compare this to other films .",negative
there was probably a good reason that the warner bros . studio chose not to allow critics to view this steven seagal film when it first opened .,negative
"and , after seeing this piece of toxic waste , i now know why .",negative
this movie is by far the worst offering that has hit the screen since possibly those ernest movies years ago .,negative
"fire down below centers its story on a little mining town in god's country , somewhere in eastern kentucky .",negative
"it's beauty and natural goodness is being slowly destroyed by an uncaring mining magnate ( kris kristopherson , who constantly looks like he wants to kill his agent for getting him this role ) .",negative
it turns out that he's filling the mines throughout kentucky with toxic waste for a tidy profit .,negative
"seagal plays jack taggert , an aikido-versed , fighting machine , who is an agent with the epa .",negative
no . . . not the cia nor the fbi nor the nsa .,negative
it's the environmental protection agency .,negative
i had no idea that epa agents were trained to be killers !,negative
taggert is sent to find the perpetrators and to bring them to justice .,negative
"written by someone named jeb , i could already envision the stereotypes of incestuous relationships , banjo-picking preachers , and dumb-as-nails rednecks .",negative
but the script puts seagal right smack dab in the middle of all of these scenarios as he tries to discreetly fit in .,negative
seagal's idea of a disguise is a long-length $1000 leather jacket .,negative
"but to get closer to the kinfolk , he will fix people's porches for free .",negative
that's another great epa asset - teaching agents how to fix porches .,negative
"slow and plodding , this project is a total mess .",negative
the sometimes allure of watching seagal is watching him outmaneuver enemies that outnumber and outgun him like in under seige .,negative
"here , his bravado basically turns into bullyness .",negative
townsfolk who are foolish enough to challenge seagal are quickly subdued .,negative
fight scenes are quick and senseless and offers no enjoyment value whatsoever .,negative
and his soap box message wears thin within the first 15 minutes .,negative
"the most annoying moment comes when he barges into the middle of a sunday church ceremony , gets behind the pulpit , and beseeches the townsfolk to take control of their lives and to help clean up the environment .",negative
"but the epitome of how moralistically mushy this film gets happens when the person responsible for the toxic dumping , kristopherson , meets up with seagal .",negative
kristopherson asks seagal how much it will take for him to go away .,negative
"seagal gallantly replies : "" i'll leave when you take the poison from the streams and the earth . """,negative
i was expecting patriotic music to start blasting and a show of fireworks in the background .,negative
this is truly nothing more than a pompous showcase for seagal's righteousness and narcissistic arrogance .,negative
"seagal has been vanguard in trying to bring a new genre into the filmplace , that of the enviro-thriller ( on deadly ground ) .",negative
"however , the message will never come across through poorly developed vehicles like this .",negative
"still , i believe in preserving mother earth , so save your $5 and please donate it instead to some worthy environmentally conscious charity .",negative
there are some pretty impressive stars in lost in space - it's just that none of them happen to be actors .,negative
"the stars i'm referring to are the computer generated ones that make up the movie's "" outer space "" ; the stars that the less impressive actors hurtle thru as they try to find their way home .",negative
"yes , in terms of acting , the star power is .",negative
 .,negative
 .,negative
"well , more like a falling star .",negative
"kinda pretty , short-lived , and pretty much dead .",negative
"lost in space , as if you really didn't know , is based on the 60's sci-fi television series of the same name .",negative
"it's the year 2058 , and earth's precious resources are quickly being usurped by the needs of its massive population .",negative
john robinson ( william hurt ) is the scientist leading a mission program to colonize a foreign planet .,negative
"earth's entire existance is contingent upon a successful mission , but nobody , whether it be john's family or hired battle pilot don west ( matt leblanc ) , seems too enthusiastic about leaving their home planet for several years .",negative
"john's family consists of his wife maureen ( mimi rogers ) , his atypical teenage daughter penny ( lacey chabert ) , his ingenious son will ( jack johnson ) , and his beautiful scientist daughter judy ( heather graham ) .",negative
"despite everyone's reluctance , the jupiter 2 spacecraft abandons planet earth and makes its way into the vast eternity of space .",negative
"unknown to anyone but the audience , there is an evil doctor stowaway determined to sabotage the entire mission .",negative
"dr . smith ( gary oldman ) has been hired by a group of rebel conspirators to turn the expedition sour , and dr . smith has re-programmed a talking robot to "" destroy robinson family "" !",negative
"when everything that could go wrong does go wrong for both sides , the spaceship is warped to an unknown destination , and now the premise of being lost in space is complete .",negative
"as for the audience , you will likely be lost in boredom by this point , wondering if the plot , like the jupiter 2 , will ever get off the ground .",negative
it's hard to tell who deserves the most blame - the incredibly bland and corny characters or the horrifically lame script ?,negative
"chabert is basically the only one to overdo it , sounding like a whiny munchkin on helium .",negative
"if you , like me , were convinced by commercials that her voice was altered for some sort of plot twist where her body would be taken over by aliens , you're wrong !",negative
that's just her normal voice !,negative
"in yet another example of a "" friend "" faltering on the big screen , leblanc is so incredibly dull and yet so obviously trying so hard to be so incredibly charming ( make sense ? ) , it makes you want to shove his ass out the escape pod corridor without an escape pod .",negative
graham is a babe - thank goodness there was something for me to think about during this film .,negative
"hurt , the black hole of excitement , sucks up any energy that might have been left .",negative
"if hurt were available in tablet form , he would be a prescription strength sleeping pill .",negative
"johnson isn't dull , he's just lame as the young know it all who winds up saving everybody's ass all the time .",negative
want an example of how cool this kid can be ?,negative
how about when he convinces the robot to think with its heart and reconsider killing the family ?,negative
"hey , don't laugh - the thing actually listened to the mr . rogers-would-be-proud sentiment .",negative
"but alas , if you thought a character couldn't be much worse , there was rogers as the epitome of generic ( or , mother as she was known ) .",negative
why hire an actress ?,negative
they could've had a white cardboard cutout with the word mom printed on it .,negative
now that would've had some pizzazz !,negative
lost in space luckily doesn't suffer in every single category that it could have .,negative
"the special effects are crisp , clear , and at least mildly captivating , unlike any of the presences onscreen save it be oldman , who plays his evil character with a great deal of fun and finesse .",negative
"unfortunately , oldman is locked away for most of the film , giving us nothing but ample mocking opportunities to enjoy .",negative
"while the special effects are pleasing to the eye , they are nothing you couldn't find in most modern sci-fi films .",negative
"contact , for example , far exceeds this film in terms of imagery and imagination .",negative
"lost in space just has too many shortcomings to ever be considered a work of cinematic art , with numerous contradictions ( the time travel aspect was horribly flawed ! ) , wooden and corny acting , worse dialogue , and an ending so disappointing , you'd be happier to have seen the entire robinson family get blown to smithereens .",negative
"then again , with an ending like this film has , it's obvious a sequel is already being considered .",negative
"what an awful note to end on , knowing there could be more of this in a year or two .",negative
"the attempt to be family oriented is commendable , but lost in space is lost with the illusion that special effects and the nostalgia of a classic tv series being revisited is enough to satisfy all age groups .",negative
"well , danger potential movie goers !",negative
danger !,negative
this movie crash lands without ever breaking thru the atmosphere of mediocrity .,negative
" "" desperate measures "" is a generic title for a film that's beyond generic .",negative
"it's also a depressing waste of talent , with the solid team of michael keaton and andy garcia unthankfully thrown thankless lead roles , not to mention once-cool director barbet schroeder sadly continuing his string of not-cool flicks -- this thriller is more "" before and after "" than "" reversal of fortune . """,negative
"the movie is a big disappointment , and yet it's somewhat easy to see what motivated such big names to attach themselves to it -- the premise is both promising and intriguing .",negative
"too bad the execution's all wrong , though , because the set-up of "" desperate measures "" boasts some rather enticing elements that deserve to be put to far better use .",negative
san francisco cop frank connor ( garcia ) is a single parent with a troubling dilemma -- his son matt ( joseph cross ) is stricken with cancer which only a bone marrow transplant can push into remission .,negative
"even worse , the only compatible donor is violent sociopath peter mccabe ( michael keaton ) , currently serving a life sentence for multiple murders and other various crimes against society .",negative
"connor tries his best to convince mccabe to go along with the surgery ; he's at first reluctant , but reconsiders after he realizes he can plan his escape at the hospital .",negative
"when he does make a run for it , connor offers close pursuit , but for different reasons than his superiors ( including the crusty brian cox ) -- they want to take mccabe down , while connor needs to keep him alive , or all hope is lost for his little boy .",negative
"one misstep "" desperate measures "" makes is in its underdevelopment of matt's illness .",negative
